{
  "$schema": "../schemas/site-structure.schema.json",
  "schemaVersion": 1,
  "homePageId": "site-portal-home",
  "pages": [
    {
      "id": "site-portal-home",
      "routeId": "site-portal-home",
      "role": "home",
      "title": "Documentation portal",
      "parentPageId": null
    },
    {
      "id": "site-policy-composition-coexistence",
      "routeId": "site-policy-composition-coexistence",
      "role": "content",
      "title": "Policy–Composition coexistence",
      "parentPageId": "site-portal-home"
    },
    {
      "id": "composition-overview",
      "routeId": "composition-overview",
      "role": "content",
      "title": "Overview",
      "parentPageId": "site-portal-home"
    },
    {
      "id": "composition-composition-concepts",
      "routeId": "composition-composition-concepts",
      "role": "content",
      "title": "Concepts and terminology",
      "parentPageId": "site-portal-home"
    },
    {
      "id": "composition-evaluation-guide",
      "routeId": "composition-evaluation-guide",
      "role": "content",
      "title": "Evaluate Composition",
      "parentPageId": "site-portal-home"
    },
    {
      "id": "composition-consumer-guide",
      "routeId": "composition-consumer-guide",
      "role": "content",
      "title": "Use Composition",
      "parentPageId": "site-portal-home"
    },
    {
      "id": "site-composition-playground",
      "routeId": "site-composition-playground",
      "role": "content",
      "title": "Composition Playground",
      "parentPageId": "site-portal-home"
    },
    {
      "id": "composition-release-guide",
      "routeId": "composition-release-guide",
      "role": "content",
      "title": "Produce a product release",
      "parentPageId": "site-portal-home"
    },
    {
      "id": "composition-composer-reference",
      "routeId": "composition-composer-reference",
      "role": "content",
      "title": "Composer reference",
      "parentPageId": "site-portal-home"
    },
    {
      "id": "composition-documentation-index",
      "routeId": "composition-documentation-index",
      "role": "content",
      "title": "Documentation index",
      "parentPageId": "site-portal-home"
    },
    {
      "id": "composition-composition-model",
      "routeId": "composition-composition-model",
      "role": "content",
      "title": "Composition model",
      "parentPageId": "site-portal-home"
    },
    {
      "id": "composition-catalog-architecture",
      "routeId": "composition-catalog-architecture",
      "role": "content",
      "title": "Production catalog",
      "parentPageId": "site-portal-home"
    },
    {
      "id": "composition-generated-contract-manifest",
      "routeId": "composition-generated-contract-manifest",
      "role": "content",
      "title": "Generated contract manifest",
      "parentPageId": "site-portal-home"
    },
    {
      "id": "composition-composer-mvp",
      "routeId": "composition-composer-mvp",
      "role": "content",
      "title": "Composer architecture",
      "parentPageId": "site-portal-home"
    },
    {
      "id": "composition-catalog-guide",
      "routeId": "composition-catalog-guide",
      "role": "content",
      "title": "Catalog guide",
      "parentPageId": "site-portal-home"
    },
    {
      "id": "composition-schema-guide",
      "routeId": "composition-schema-guide",
      "role": "content",
      "title": "Schema guide",
      "parentPageId": "site-portal-home"
    },
    {
      "id": "composition-publication-boundary",
      "routeId": "composition-publication-boundary",
      "role": "content",
      "title": "Publication boundary",
      "parentPageId": "site-portal-home"
    },
    {
      "id": "composition-provider-maintenance",
      "routeId": "composition-provider-maintenance",
      "role": "content",
      "title": "Composition maintainer overview",
      "parentPageId": "site-portal-home"
    },
    {
      "id": "composition-installer-release",
      "routeId": "composition-installer-release",
      "role": "content",
      "title": "Installer release",
      "parentPageId": "site-portal-home"
    },
    {
      "id": "composition-composition-authority-migration",
      "routeId": "composition-composition-authority-migration",
      "role": "content",
      "title": "Authority migration history",
      "parentPageId": "site-portal-home"
    },
    {
      "id": "composition-skill-first-use-walkthrough",
      "routeId": "composition-skill-first-use-walkthrough",
      "role": "content",
      "title": "First-use walkthrough",
      "parentPageId": "site-portal-home"
    },
    {
      "id": "composition-skill-overview",
      "routeId": "composition-skill-overview",
      "role": "content",
      "title": "Overview",
      "parentPageId": "site-portal-home"
    },
    {
      "id": "composition-skill-contract",
      "routeId": "composition-skill-contract",
      "role": "content",
      "title": "Skill contract",
      "parentPageId": "site-portal-home"
    },
    {
      "id": "composition-skill-documentation-index",
      "routeId": "composition-skill-documentation-index",
      "role": "content",
      "title": "Documentation index",
      "parentPageId": "site-portal-home"
    },
    {
      "id": "composition-skill-profiles",
      "routeId": "composition-skill-profiles",
      "role": "content",
      "title": "Skill profiles",
      "parentPageId": "site-portal-home"
    },
    {
      "id": "composition-skill-capability-map",
      "routeId": "composition-skill-capability-map",
      "role": "content",
      "title": "Skill/capability map",
      "parentPageId": "site-portal-home"
    },
    {
      "id": "composition-skill-architecture",
      "routeId": "composition-skill-architecture",
      "role": "content",
      "title": "Architecture",
      "parentPageId": "site-portal-home"
    },
    {
      "id": "composition-website-webapp-selection",
      "routeId": "composition-website-webapp-selection",
      "role": "content",
      "title": "Choose Website or Web application",
      "parentPageId": "site-portal-home"
    },
    {
      "id": "composition-web-url-path-design-guidance",
      "routeId": "composition-web-url-path-design-guidance",
      "role": "content",
      "title": "URL and path design guidance",
      "parentPageId": "site-portal-home"
    },
    {
      "id": "composition-web-routes-v1-migration",
      "routeId": "composition-web-routes-v1-migration",
      "role": "content",
      "title": "Routes v1 to v2",
      "parentPageId": "site-portal-home"
    },
    {
      "id": "composition-web-routes-v2-migration",
      "routeId": "composition-web-routes-v2-migration",
      "role": "content",
      "title": "Routes v2 to v3",
      "parentPageId": "site-portal-home"
    },
    {
      "id": "composition-web-routes-v3-migration",
      "routeId": "composition-web-routes-v3-migration",
      "role": "content",
      "title": "Routes v3 to v4",
      "parentPageId": "site-portal-home"
    },
    {
      "id": "composition-web-routes-v4-migration",
      "routeId": "composition-web-routes-v4-migration",
      "role": "content",
      "title": "Routes v4 to v5",
      "parentPageId": "site-portal-home"
    },
    {
      "id": "composition-website-product-walkthrough",
      "routeId": "composition-website-product-walkthrough",
      "role": "content",
      "title": "Product walkthrough",
      "parentPageId": "site-portal-home"
    },
    {
      "id": "composition-webapp-product-walkthrough",
      "routeId": "composition-webapp-product-walkthrough",
      "role": "content",
      "title": "Product walkthrough",
      "parentPageId": "site-portal-home"
    },
    {
      "id": "composition-webapp-overview",
      "routeId": "composition-webapp-overview",
      "role": "content",
      "title": "Overview",
      "parentPageId": "site-portal-home"
    },
    {
      "id": "composition-webapp-template",
      "routeId": "composition-webapp-template",
      "role": "content",
      "title": "Template contract",
      "parentPageId": "site-portal-home"
    },
    {
      "id": "composition-webapp-documentation-index",
      "routeId": "composition-webapp-documentation-index",
      "role": "content",
      "title": "Documentation index",
      "parentPageId": "site-portal-home"
    },
    {
      "id": "composition-webapp-contracts",
      "routeId": "composition-webapp-contracts",
      "role": "content",
      "title": "Webapp contracts",
      "parentPageId": "site-portal-home"
    },
    {
      "id": "composition-webapp-responsibility-boundaries",
      "routeId": "composition-webapp-responsibility-boundaries",
      "role": "content",
      "title": "Responsibility boundaries",
      "parentPageId": "site-portal-home"
    },
    {
      "id": "composition-webapp-validation-toolchain",
      "routeId": "composition-webapp-validation-toolchain",
      "role": "content",
      "title": "Validation toolchain",
      "parentPageId": "site-portal-home"
    },
    {
      "id": "composition-surfaces-v2-migration",
      "routeId": "composition-surfaces-v2-migration",
      "role": "content",
      "title": "Surfaces v1 to v2",
      "parentPageId": "site-portal-home"
    },
    {
      "id": "composition-ui-states-migration",
      "routeId": "composition-ui-states-migration",
      "role": "content",
      "title": "UI states v1 to v2",
      "parentPageId": "site-portal-home"
    },
    {
      "id": "site-capabilities-overview",
      "routeId": "site-capabilities-overview",
      "role": "content",
      "title": "Overview",
      "parentPageId": "site-portal-home"
    },
    {
      "id": "composition-runtime-decision-record",
      "routeId": "composition-runtime-decision-record",
      "role": "content",
      "title": "Runtime decision record",
      "parentPageId": "site-portal-home"
    },
    {
      "id": "composition-runtime-selection",
      "routeId": "composition-runtime-selection",
      "role": "content",